{
  "$schema": "https://raw.githubusercontent.com/omamori-labs/Omamori/main/schemas/mod.schema.json",
  "id": "yourname.mymod",
  "name": "OmamoriMod",
  "version": "1.0.0",
  "author": "MOD_AUTHOR",
  "description": "",
  "entry": "OmamoriMod.dll",
  "apiVersion": "__OMAMORI_API__",
  "capabilities": ["Cosmetic"],
  "hooks": {
    "MainMenu": "optional",
    "PlayEvents": "optional"
  }
}
